{
  "id": "17841400123456789",
  "username": "examplebusiness",
  "name": "Example Business",
  "biography": "Official account for Example Business.",
  "website": "https://www.example.com",
  "profile_picture_url": "https://scontent.cdninstagram.com/example.jpg",
  "followers_count": 15000,
  "follows_count": 500,
  "media_count": 342
}